{
  "pack_id": "pack02",
  "title": "Electrical works at Greenvale Community Hall",
  "reference": "GRE/ELEC/2026/057",
  "client": "Greenvale Municipality",
  "location": "Greenvale",
  "closing_at": "2026-12-23T11:00:00+02:00",
  "tags": [
    "clean",
    "boq-xlsx",
    "clean"
  ],
  "documents": [
    {
      "filename": "tender.pdf",
      "kind": "tender_document",
      "format": "pdf",
      "scanned": false,
      "pages": 8
    },
    {
      "filename": "boq.xlsx",
      "kind": "boq",
      "format": "xlsx",
      "scanned": false,
      "pages": null
    },
    {
      "filename": "quotation_1_sparkmore_supplies.pdf",
      "kind": "quotation",
      "format": "pdf",
      "scanned": false,
      "pages": null
    },
    {
      "filename": "quotation_2_greenvale_cable_and_conduit.xlsx",
      "kind": "quotation",
      "format": "xlsx",
      "scanned": false,
      "pages": null
    }
  ],
  "requirements": [
    {
      "id": "pack02-R01",
      "description": "Submit sealed tender by 11:00 on Thursday 23 December 2026",
      "requirement_type": "deadline",
      "mandatory_status": "mandatory",
      "evidence_quote": "Sealed tenders must be deposited in the tender box at Greenvale Civic Centre, 12 Example Street no later than 11:00 on Thursday 23 December 2026.",
      "keyword": "thursday 23 december 2026",
      "source": {
        "document": "tender.pdf",
        "page": 3,
        "printed_page": "1",
        "sheet": null,
        "cell_range": null
      }
    },
    {
      "id": "pack02-R02",
      "description": "CIDB grading of 6EP or higher (electrical)",
      "requirement_type": "eligibility",
      "mandatory_status": "mandatory",
      "evidence_quote": "Only tenderers registered with the Construction Industry Development Board with a contractor grading of 6EP or higher in the electrical engineering works category may submit tenders.",
      "keyword": "6ep",
      "source": {
        "document": "tender.pdf",
        "page": 8,
        "printed_page": "6",
        "sheet": null,
        "cell_range": null
      }
    },
    {
      "id": "pack02-R03",
      "description": "Valid tax compliance status pin",
      "requirement_type": "document",
      "mandatory_status": "mandatory",
      "evidence_quote": "Tenderers must submit a valid tax compliance status pin issued by the South African Revenue Service.",
      "keyword": "tax compliance",
      "source": {
        "document": "tender.pdf",
        "page": 4,
        "printed_page": "2",
        "sheet": null,
        "cell_range": null
      }
    },
    {
      "id": "pack02-R04",
      "description": "Completed and signed Form of Offer and Acceptance",
      "requirement_type": "document",
      "mandatory_status": "mandatory",
      "evidence_quote": "The Form of Offer and Acceptance must be completed and signed by an authorised representative of the tenderer.",
      "keyword": "form of offer",
      "source": {
        "document": "tender.pdf",
        "page": 5,
        "printed_page": "3",
        "sheet": null,
        "cell_range": null
      }
    },
    {
      "id": "pack02-R05",
      "description": "Complete declaration of interest and past SCM practices",
      "requirement_type": "document",
      "mandatory_status": "mandatory",
      "evidence_quote": "Tenderers must complete the declaration of interest and the declaration of past supply chain management practices.",
      "keyword": "declaration of interest",
      "source": {
        "document": "tender.pdf",
        "page": 2,
        "printed_page": "",
        "sheet": null,
        "cell_range": null
      }
    },
    {
      "id": "pack02-R06",
      "description": "Programme showing completion within 10 weeks",
      "requirement_type": "technical",
      "mandatory_status": "mandatory",
      "evidence_quote": "Tenderers must submit a programme showing completion within 10 weeks of the commencement date.",
      "keyword": "10 weeks",
      "source": {
        "document": "tender.pdf",
        "page": 3,
        "printed_page": "1",
        "sheet": null,
        "cell_range": null
      }
    },
    {
      "id": "pack02-R07",
      "description": "B-BBEE certificate or affidavit if claiming preference points",
      "requirement_type": "document",
      "mandatory_status": "conditional",
      "evidence_quote": "If preference points are claimed, a certified copy of a valid B-BBEE certificate or sworn affidavit must be submitted.",
      "keyword": "b-bbee",
      "source": {
        "document": "tender.pdf",
        "page": 7,
        "printed_page": "5",
        "sheet": null,
        "cell_range": null
      }
    },
    {
      "id": "pack02-R08",
      "description": "Rates valid for 90 days",
      "requirement_type": "pricing",
      "mandatory_status": "mandatory",
      "evidence_quote": "Tender rates must remain valid for 90 days after the closing date.",
      "keyword": "90 days",
      "source": {
        "document": "tender.pdf",
        "page": 3,
        "printed_page": "1",
        "sheet": null,
        "cell_range": null
      }
    },
    {
      "id": "pack02-R09",
      "description": "Comply with SANS 10142-1",
      "requirement_type": "technical",
      "mandatory_status": "mandatory",
      "evidence_quote": "All electrical work must comply with SANS 10142-1 and be certified by a registered person.",
      "keyword": "10142",
      "source": {
        "document": "tender.pdf",
        "page": 7,
        "printed_page": "5",
        "sheet": null,
        "cell_range": null
      }
    },
    {
      "id": "pack02-R10",
      "description": "Defects liability period of 6 months",
      "requirement_type": "technical",
      "mandatory_status": "mandatory",
      "evidence_quote": "The contractor shall provide a defects liability period of 6 months from the date of practical completion.",
      "keyword": "6 months",
      "source": {
        "document": "tender.pdf",
        "page": 7,
        "printed_page": "5",
        "sheet": null,
        "cell_range": null
      }
    }
  ],
  "boq_items": [
    {
      "item_number": "A1",
      "section": "Preliminaries and General",
      "description": "Site establishment, offices and storage",
      "unit": "sum",
      "quantity": "1",
      "unit_price": null,
      "raw_unit": "sum",
      "raw_quantity": "1",
      "flags": [],
      "source": {
        "document": "boq.xlsx",
        "page": null,
        "printed_page": null,
        "sheet": "BoQ",
        "cell_range": "A5:F5"
      }
    },
    {
      "item_number": "A2",
      "section": "Preliminaries and General",
      "description": "Insurance and guarantees",
      "unit": "sum",
      "quantity": "1",
      "unit_price": null,
      "raw_unit": "sum",
      "raw_quantity": "1",
      "flags": [],
      "source": {
        "document": "boq.xlsx",
        "page": null,
        "printed_page": null,
        "sheet": "BoQ",
        "cell_range": "A6:F6"
      }
    },
    {
      "item_number": "B1",
      "section": "Distribution Boards",
      "description": "Sub distribution board, 63 A, 12-way, surface mounted",
      "unit": "no",
      "quantity": "4",
      "unit_price": null,
      "raw_unit": "no",
      "raw_quantity": "4",
      "flags": [],
      "source": {
        "document": "boq.xlsx",
        "page": null,
        "printed_page": null,
        "sheet": "BoQ",
        "cell_range": "A8:F8"
      }
    },
    {
      "item_number": "B2",
      "section": "Distribution Boards",
      "description": "Miniature circuit breaker, 1-pole, 32 A, 6 kA",
      "unit": "no",
      "quantity": "57",
      "unit_price": null,
      "raw_unit": "no",
      "raw_quantity": "57",
      "flags": [],
      "source": {
        "document": "boq.xlsx",
        "page": null,
        "printed_page": null,
        "sheet": "BoQ",
        "cell_range": "A9:F9"
      }
    },
    {
      "item_number": "C1",
      "section": "Containment",
      "description": "Galvanised cable tray, 100 mm wide, including supports",
      "unit": "m",
      "quantity": "77",
      "unit_price": null,
      "raw_unit": "m",
      "raw_quantity": "77",
      "flags": [],
      "source": {
        "document": "boq.xlsx",
        "page": null,
        "printed_page": null,
        "sheet": "BoQ",
        "cell_range": "A11:F11"
      }
    },
    {
      "item_number": "C2",
      "section": "Containment",
      "description": "PVC conduit, 20 mm, surface mounted",
      "unit": "m",
      "quantity": "1320",
      "unit_price": null,
      "raw_unit": "m",
      "raw_quantity": "1320",
      "flags": [],
      "source": {
        "document": "boq.xlsx",
        "page": null,
        "printed_page": null,
        "sheet": "BoQ",
        "cell_range": "A12:F12"
      }
    },
    {
      "item_number": "D1",
      "section": "Cables",
      "description": "2-core 2.5 mm2 PVC insulated copper cable, installed in conduit",
      "unit": "m",
      "quantity": "237",
      "unit_price": null,
      "raw_unit": "m",
      "raw_quantity": "237",
      "flags": [],
      "source": {
        "document": "boq.xlsx",
        "page": null,
        "printed_page": null,
        "sheet": "BoQ",
        "cell_range": "A14:F14"
      }
    },
    {
      "item_number": "D2",
      "section": "Cables",
      "description": "2-core 4 mm2 PVC insulated copper cable, installed in conduit",
      "unit": "m",
      "quantity": "479",
      "unit_price": null,
      "raw_unit": "m",
      "raw_quantity": "479",
      "flags": [],
      "source": {
        "document": "boq.xlsx",
        "page": null,
        "printed_page": null,
        "sheet": "BoQ",
        "cell_range": "A15:F15"
      }
    },
    {
      "item_number": "D3",
      "section": "Cables",
      "description": "2-core 10 mm2 PVC insulated copper cable, installed in conduit",
      "unit": "m",
      "quantity": "127",
      "unit_price": null,
      "raw_unit": "m",